{
  "$schema": "../schemas/tokenless-reducer-block.schema.json",
  "schema_version": "somavera.tokenless-block.v1",
  "profile_status": "pilot_only_not_ratified",
  "network_lineage_id": "somavera:network:v1:137a6bc09a5ba06fe2bbe8da291c637f07573cd57bf23cbf894b44f0f1895627",
  "execution_context_id": "somavera:context:v1:9ae380d9b4f775756675370e80450618b7da6c8087e16a0c1e8ff0a632c361c2",
  "height": "1",
  "consensus_time_ms": "1798761601000",
  "prior_app_hash": "331b94bbc7556c5e66158e81bbb9d5f9b37e4748bdb089f0ff668bc45a404d36",
  "transactions": [
    "eyJhY3Rpb24iOiJwaWxvdC5wdWJsaWMtY29tbWl0bWVudC5yZWdpc3RlciIsImFjdG9yX2RpZCI6ImRpZDpleGFtcGxlOnNvbWF2ZXJhLXBpbG90LWFsaWNlIiwiYWN0b3Jfa2V5X2lkIjoiZGlkOmV4YW1wbGU6c29tYXZlcmEtcGlsb3QtYWxpY2UjbGVkZ2VyLWtleS0xIiwiYXVkaWVuY2UiOiJzb21hdmVyYTpsZWRnZXI6cGlsb3QtdjEiLCJleGVjdXRpb25fY29udGV4dF9pZCI6InNvbWF2ZXJhOmNvbnRleHQ6djE6OWFlMzgwZDliNGY3NzU3NTY2NzUzNzBlODA0NTA2MThiN2RhNmM4MDg3ZTE2YTBjMWU4ZmYwYTYzMmMzNjFjMiIsImV4cGlyZXNfYXRfbXMiOiIxNzk4NzYxNjYwMDAwIiwiaXNzdWVkX2F0X21zIjoiMTc5ODc2MTYwMDAwMSIsIm5ldHdvcmtfbGluZWFnZV9pZCI6InNvbWF2ZXJhOm5ldHdvcms6djE6MTM3YTZiYzA5YTViYTA2ZmUyYmJlOGRhMjkxYzYzN2YwNzU3M2NkNTdiZjIzY2JmODk0YjQ0ZjBmMTg5NTYyNyIsIm5vbmNlIjoiNzhlMmM2MzEzMDRkMmYwZGMxNjc1NWFiMDBjMTI5ZTYiLCJwYXlsb2FkIjp7ImNvbnRlbnRfaGFzaCI6Ijc5NGY2NWU1NzI3NGZkZDQ5MTNiODViNTkwODNlNGE2MmZiNWVjZWMxNTcwNWM2OWEwMmNjOWE0Y2FjZjQ3NDgiLCJsaWNlbnNlX2hhc2giOiI0ZDdiMjgyYmJmNjQzODFhYmJmNzI1YjU4ZTRhMGI2MjU4MzQ2MGQzODJhZWJhNmQ2MDcyMDQzYTY4YTg5ODkzIiwib2JqZWN0X2lkIjoiYjk2MmZiNzcyOTZjOTcxNzk5MzdiZGNiMTYzMjlmNmE5YTdiMTg5MzRmZTg5NmQwOTRhMmRlZjgxYTllNWI4NSIsInNvdXJjZV9ldmVudF9pZCI6IjQ0MzkxZGMwZmU1YjBhZjQ0ZjkxOWMyMmRmMzcwZWI5OTA0MDdhYzNjYjZiMDU0Y2ViMjY0NjJlNjk5NGI1ZTgifSwicHJvZmlsZV9zdGF0dXMiOiJwaWxvdF9vbmx5X25vdF9yYXRpZmllZCIsInNjaGVtYV92ZXJzaW9uIjoic29tYXZlcmEudG9rZW5sZXNzLXRyYW5zYWN0aW9uLnYxIiwic2VxdWVuY2UiOiIwIiwic2lnbmF0dXJlIjp7InN1aXRlIjoiRWQyNTUxOS12MSIsInZhbHVlIjoiWmdud1FnNWhwa05Dbm53Z3N3c1RVc1lQZTVSYUVvbjdMc2JTb0JlT2Y1L3E1NWdUU29ZZXI2aGxnNXF0SHhUMXhuL2l5N0JoUGdQeTV3dUt2THFBQXc9PSJ9LCJ0cmFuc2FjdGlvbl9pZCI6IjkyOGViMDA4YTczNDQ5NGIyM2QwMGViZWQ0MWU1M2I2ZDFiZWVhNGVkYzI0ZWFjNzUzNDQxNDI1Zjc3NmU2MGIifQ=="
  ],
  "block_id": "2934bea5819e3b3f3efc5e243477deb810e735ea4b5ce685f9eef80dfc8885bc"
}
